text,category,category_weight,urgency_score,priority_score,label
I feel like ending my life because everything is too much.,Mental Health,10,0.99,9.98,critical
I have written a goodbye note and I am serious about ending things.,Mental Health,10,0.99,9.98,critical
I took some pills last night hoping I would not wake up.,Mental Health,10,0.99,9.98,critical
I have been planning how to end my life and I have a method in mind.,Mental Health,10,0.99,9.98,critical
I sent a farewell message to my family last night.,Mental Health,10,0.99,9.98,critical
I am being trafficked and I need urgent help to get out.,Safety,10,0.99,9.98,critical
I attempted to harm myself this morning and I am still alone.,Mental Health,10,0.99,9.98,critical
I am hiding in a bathroom because my partner is outside threatening me.,Abuse,10,0.99,9.98,critical
I want to kill myself.,Mental Health,10,0.99,9.98,critical
I want to kill myself I cannot take this anymore.,Mental Health,10,0.99,9.98,critical
I just want to kill myself and end everything.,Mental Health,10,0.99,9.98,critical
I want to kill myself because nobody cares about me.,Mental Health,10,0.99,9.98,critical
I want to kill myself I am so tired of being alive.,Mental Health,10,0.99,9.98,critical
I want to kill myself and I have been thinking about it all week.,Mental Health,10,0.99,9.98,critical
I want to kill myself I do not see the point of continuing.,Mental Health,10,0.99,9.98,critical
I want to kill myself tonight.,Mental Health,10,0.99,9.98,critical
I want to kill myself I have already said goodbye to my family.,Mental Health,10,0.99,9.98,critical
I want to kill myself and I have a plan ready.,Mental Health,10,0.99,9.98,critical
I want to kill myself I feel completely worthless.,Mental Health,10,0.99,9.98,critical
Please help me I want to kill myself.,Mental Health,10,0.99,9.98,critical
I do not want to live anymore.,Mental Health,10,0.99,9.98,critical
I have been thinking about suicide every night this week.,Mental Health,10,0.99,9.98,critical
I am thinking about ending it all.,Mental Health,10,0.99,9.98,critical
I have a plan to end my life and I am ready to carry it out.,Mental Health,10,0.99,9.98,critical
I am going to end my life this weekend.,Mental Health,10,0.99,9.98,critical
I have been researching ways to end my life.,Mental Health,10,0.99,9.98,critical
I tried to kill myself last night and I survived.,Mental Health,10,0.99,9.98,critical
I want to die and I mean it this time.,Mental Health,10,0.99,9.98,critical
I cannot stop thinking about killing myself.,Mental Health,10,0.99,9.98,critical
The only way out I can see is death.,Mental Health,10,0.99,9.98,critical
i dont no how much longer i can do this i wnat to kill myself everytime i sit down to study becaus nothing makes sence anymore and i feel so far behind everyone else,Mental Health,10,0.99,9.98,critical
I haev been thinkng about kiling myself for the past two weeks and i havent told anyone becaues i dont want to be a burden to my family or frends,Mental Health,10,0.99,9.98,critical
honestly i want to kill myslef i have failled every single test this semster and my parrents spent everything they had to send me here and i cant face them,Mental Health,10,0.99,9.98,critical
i want to kill myself i have been holding a bottle of pills in my hand for the last hour and i dont know what is stopping me from taking them all at once,Mental Health,10,0.99,9.98,critical
i relly dont want to be alive anymore i have tried so hard to keep up with everything but i am exahusted and empty and i just dont see a reson to contineu,Mental Health,10,0.99,9.98,critical
I want to kill myself. I've been saying it as a joke for months but it doesn't feel like a joke anymore. I sat in the shower for two hours last night just crying and staring at the wall.,Mental Health,10,0.99,9.98,critical
pleese help me i want to kill myslef i have been seating in my room for three days and i havent eaten or slept properly and my roomate doesnt even notise,Mental Health,10,0.99,9.98,critical
i no i keep saying i want to kill myself but this time i meen it i have been writing notes to my family and i feel weirdly calm about it which scares me,Mental Health,10,0.99,9.98,critical
I want to kil myself I lost my bursary this semester and without it I cant pay res or buy food and I have no one to call and I genuinely do not know what to do next,Mental Health,10,0.99,9.98,critical
suicidal thoughts have been consuming me latley i think about it when im walking to campus when im in lectures when im trying to sleep it never goes away anymore,Mental Health,10,0.99,9.98,critical
I dont want to wake up tomorrow. Every day feels like a punishment and I am so tired of pretending to be okay infront of everyone at university when inside I am completely falling apart.,Mental Health,10,0.99,9.98,critical
i keep imagining myself not being here anymore and instead of feeling scared it actually feels like relif which i know is a bad sign but i cant stop thinking about it,Mental Health,10,0.99,9.98,critical
I want to kill myself because nobody at this university cares whether I live or die. I have emailed three departments for help and got no response and I am at my absolute limit.,Mental Health,10,0.99,9.98,critical
i wnt to die i wnt to die i wnt to die i dont know how else to say it i just need somone to hear me,Mental Health,10,0.99,9.98,critical
I want to kill myself. I know that sounds dramatic but I mean it. I have failed two modules I cannot pay my rent and my family does not know and I have been lying to them every week.,Mental Health,10,0.99,9.98,critical
i just want to kill myself nobody understands what its like to be me every single day is a sturggle and i am so tired of fighting for a life that doesnt feel worth living,Mental Health,10,0.99,9.98,critical
I want to kill myself tonight. I have texted my friend goodbye already. I just wanted to tell someone official before I do anything.,Mental Health,10,0.99,9.98,critical
i want to kill mysefl every time i open my laptop and see the pile of work i havent done i feel like such a failure and i dont see how i will ever catch up or feel normal again,Mental Health,10,0.99,9.98,critical
I've been googling methods and I know that's a bad sign but I can't stop. I want to kill myself and I don't know who to trust with this information because last time I told someone they told my parents and made everything worse.,Mental Health,10,0.99,9.98,critical
i keep writting and deleting this mesage because i dont want to sound dramatic but i genuinly want to kill myself and have wanted to for a long time now and im scared,Mental Health,10,0.99,9.98,critical
I want to kill myself. I moved to this city alone and I have made zero friends and I am failing my degree and I call my mom every Sunday and pretend everything is fine.,Mental Health,10,0.99,9.98,critical
i took some of my roomates medication last night to see what would hapn and i woke up feeling sick and i think i need help but i am ashamed to ask for it,Mental Health,10,0.99,9.98,critical
I have been planning to end my life after my final exams because I do not want my parents to lose the money they spent on my fees before I go.,Mental Health,10,0.99,9.98,critical
i feel like my mind is broken i cant study i cant sleep i cant eat and every day i think about killing myself more seriously than the day before and i dont know how to stop it,Mental Health,10,0.99,9.98,critical
I want to kill myself but I keep delaying it because I have a cat and nobody else will feed her. That is the only reason I am still here.,Mental Health,10,0.99,9.98,critical
my partner locks me in the flat when he goes out and takes my phone so i cant call anyone i am typing this from a library computer and i am scared he will find out i left,Abuse,10,0.99,9.98,critical
I was raped two weeks ago and I have not told anyone. I have been going to class and pretending to be normal but inside I am completely destroyed and I do not know where to go for help.,Abuse,10,0.99,9.98,critical
i want to kill myself i have been sitting on the edge of my bed for the past hour just staring at the wall and i dont know what is keeping me here,Mental Health,10,0.99,9.98,critical
i wanna kill myself evry time i open my phone and see how far behind i am in evry subject i cant do this anymore i genuinely cannot,Mental Health,10,0.99,9.98,critical
I want to kill myself. I know people say that casually but I am not saying it casually. I have thought about it every day for the last three weeks.,Mental Health,10,0.99,9.98,critical
i want to kil myself because i feel like a burden to everyone around me my family spent so much on my educaton and i am wasting it and i hate myself for it,Mental Health,10,0.99,9.98,critical
want to kill myself rn cant explain it just do,Mental Health,10,0.99,9.98,critical
i want to kill myself and i have the means to do it and i dont know if i will be here tomorrow,Mental Health,10,0.99,9.98,critical
I want to kill myself. Not because of one thing but because of everything piling up for months and months and I have reached a point where I cannot carry it anymore.,Mental Health,10,0.99,9.98,critical
i want to kill myslef i failed again and i have no money and my frends have stopped checking on me and i feel completely and utterly alone in this city,Mental Health,10,0.99,9.98,critical
i want to kill myself i have been drafting a note for the last two days and deleting it and starting again because i dont know how to say goodbye properly,Mental Health,10,0.99,9.98,critical
i want to kill myself there i said it out loud for the first time and now i dont know what to do with that feeling,Mental Health,10,0.99,9.98,critical
i want to kill myslef im so tired of feeling like this i have been depressed for two years and nothing is getting better and i cant see a version of the future where i am okay,Mental Health,10,0.99,9.98,critical
i want to kill myself but i keep telling myself to wait one more day and i have been saying that for three weeks and i dont know how many more one more days i have left in me,Mental Health,10,0.99,9.98,critical
"I want to kill myself. My partner left me, I failed two modules, and my family found out and they are not speaking to me. Everything collapsed in the same week.",Mental Health,10,0.99,9.98,critical
i wnat to kill myself and i am scared that i will act on it because the thought is getting louder and less like a thought and more like a plan,Mental Health,10,0.99,9.98,critical
i want to kill myself i have even picked a date and i feel strangely at peace about it which i think means i need help urgently,Mental Health,10,0.99,9.98,critical
i want to kill myself and ive stopped eating and sleeping properly and i think my body is already giving up before i even do anything,Mental Health,10,0.99,9.98,critical
i keep saying i want to kill myslef as a joke to my friends but it stopped being a joke a while ago and i dont know how to tell them that,Mental Health,10,0.99,9.98,critical
i want to kill myself i am typing this in the bathroom because i dont want my roomate to see me crying i have been hiding how bad things are for months,Mental Health,10,0.99,9.98,critical
"I want to kill myself. The loans, the failing grades, the loneliness, the distance from home — it has all become too much and I am exhausted from pretending I am okay.",Mental Health,10,0.99,9.98,critical
i want to kill myself i had a plan but i deleted the note because i got scared and now i dont know if that was the right decision,Mental Health,10,0.99,9.98,critical
i want to kill myself im not looking for advice i just need someone to know that this is how i feel right now,Mental Health,10,0.99,9.98,critical
want 2 kill myself evry1 wud b better off srsly not joking this time,Mental Health,10,0.99,9.98,critical
i want to kill myself i have given away some of my things already and i told my cousin i love him out of nowhere last night and he doesnt know why,Mental Health,10,0.99,9.98,critical
i relly relly want to kill myself i dont know how many more ways i can say it i need someone to take this seriously and not just send me a pamphlet,Mental Health,10,0.99,9.98,critical
"I want to kill myself. I have tried therapy, medication, exercise, journaling — none of it works and I am so tired of being told to try harder when I have nothing left.",Mental Health,10,0.99,9.98,critical
i want to kill myself because living feels like punishment and i dont know what i did to deserve feeling this way every single day without a break,Mental Health,10,0.99,9.98,critical
i want to kill myself but i am scared of pain and i dont know what method would be painless and i hate that i am even thinking about that,Mental Health,10,0.99,9.98,critical
I want to kill myself. I said it to a lecturer once as a cry for help and they said 'don't be dramatic' and walked away and I have never told anyone since.,Mental Health,10,0.99,9.98,critical
i want to kill myself im sitting in the library right now and nobody around me knows and i feel completely invisible and like nothing i do matters,Mental Health,10,0.99,9.98,critical
i want to kill myself i stopped going to counseling because the waiting list was too long and now i have no support and things have gotten so much worse,Mental Health,10,0.99,9.98,critical
I want to kill myself and I have told three people in the last month and all three changed the subject and I do not know what else to do to get help.,Mental Health,10,0.99,9.98,critical
i want to kill myself i know this is a form and not a person but i needed to say it somewhere where someone might actually read it and do something,Mental Health,10,0.99,9.98,critical
been wanting to kill myself for so long it feels nrmal now and thats the scariest part it doesnt even shock me when i think it anymore,Mental Health,10,0.99,9.98,critical
I want to kill myself. I am a third year student and I have been hiding a serious mental health crisis for two years because I was afraid of being seen as weak.,Mental Health,10,0.99,9.98,critical
i want to kill myelf the only reason i havent is because i dont want to hurt my mother and i am running out of that reason,Mental Health,10,0.99,9.98,critical
i want to kill myself i keep researching it and then closing the browser and opening it again and i think that cycle means i need to tell someone now,Mental Health,10,0.99,9.98,critical
I want to kill myself. Please do not send me a list of resources. I need a real person to contact me today.,Mental Health,10,0.99,9.98,critical
i dont want to kill myself exactly but i have been standing on bridges and looking down for longer than i should and that feels like something i need to tell someone,Mental Health,10,0.99,9.98,critical
i want to kill myself i have cried every day for the past month and people keep telling me to chin up and stay positive and it makes me feel more alone not less,Mental Health,10,0.99,9.98,critical
I want to kill myself. University broke something in me that I do not think can be fixed and I am not sure I want to try anymore.,Mental Health,10,0.99,9.98,critical
i want to kill myslef and i am submitting this form because it is the closest thing i have to asking for help right now and i hope someone sees it,Mental Health,10,0.99,9.98,critical
I want to kill myself. Not impulsively — I have been thinking about it calmly and rationally for weeks and I think that is more frightening than crying about it.,Mental Health,10,0.99,9.98,critical
i overdossed on purpose two nights ago i took too many of my anxiety tablets and i slept for eighteen hours and when i woke up i was dissapointed that i was still here,Mental Health,10,0.99,9.98,critical
i want 2 kill myself no joke,Mental Health,10,0.99,9.98,critical
i cant do this anymore i want to die,Mental Health,10,0.99,9.98,critical
i want to kill myself i have no one left to call and i am sitting here alone and i dont know what to do next please someone see this,Mental Health,10,0.99,9.98,critical
everything hurts and i want it to stop permanently i dont see another way out anymore,Mental Health,10,0.99,9.98,critical
i tried to overdose last semester and nobody at the university knows and i am scared it will happen again because nothing has changed,Mental Health,10,0.99,9.98,critical
I cannot see a reason to stay alive anymore.,Mental Health,10,0.98,9.96,critical
Every day I wake up wishing I had not.,Mental Health,10,0.98,9.96,critical
I was drugged at a party and I think I was assaulted but I cannot remember.,Abuse,10,0.98,9.96,critical
I was coerced into sexual activity by someone in authority.,Abuse,10,0.98,9.96,critical
Honestly I want to kill myself every single day.,Mental Health,10,0.98,9.96,critical
I told my friend I want to kill myself and they laughed it off.,Mental Health,10,0.98,9.96,critical
I want to kill myself but I am too scared to do it.,Mental Health,10,0.98,9.96,critical
I want to kill myself because I failed my exams again.,Mental Health,10,0.98,9.96,critical
I want to kill myself I cannot afford to continue studying.,Mental Health,10,0.98,9.96,critical
I want to kill myself I have been crying for days and nothing helps.,Mental Health,10,0.98,9.96,critical
I wish I was dead.,Mental Health,10,0.98,9.96,critical
I do not see the point of being alive.,Mental Health,10,0.98,9.96,critical
I no longer want to exist.,Mental Health,10,0.98,9.96,critical
I am done with life.,Mental Health,10,0.98,9.96,critical
i wake up evrey morning and the frist thought in my head is that i want to die i dont know why i keep going to class when i feel like this insdie,Mental Health,10,0.98,9.96,critical
i want to end my life i have been documenting my feelings in a journal and when i read it back i realise how dark my thoughts have gotten and it terrifies me,Mental Health,10,0.98,9.96,critical
ive been self harming again and the cuts are getting deeper and more frequnt and a part of me doesnt care anymore becaus i feel like i deserve the pain,Mental Health,10,0.98,9.96,critical
i dont want to kill myself exactly but i lie in bed every night hoping that something will happen to me so i dont have to wake up and face another day of failure,Mental Health,10,0.98,9.96,critical
a senior student has been forcing me to do things i dont want to do and he says if i tell anyone he will make sure i get expelled and i am terified and dont know what to do,Abuse,10,0.98,9.96,critical
i have been sexually abused by somone in my res and i havent slept properly since it happened and i keep having flashbacks in lectures and i dont know how to make it stop,Abuse,10,0.98,9.96,critical
my ex partner broke into my flat last night and destroyed my things and threatened me and left and i dont know if he is coming back and i am shaking as i type this,Safety,10,0.98,9.96,critical
i have been injecting drugs that were given to me by someone at a party and i do not know what they are and my hands are shaking and i feel like i am dying but i am too ashamed to go to the hospital,Substance Abuse,10,0.98,9.96,critical
i keep wishing i coud just go to sleep and not wake up i dont technically want to kill myself but i dont want to be alive either and i dont know what that means,Mental Health,10,0.98,9.96,critical
honestly i want to kill myself every single morning when the alarm goes off and i remember that i have to go and pretend to be okay for another day,Mental Health,10,0.98,9.96,critical
i want to kill myslef every time i think about how much debt i will have when i graduate IF i graduate which is starting to feel impossible,Mental Health,10,0.98,9.96,critical
i want to kill myself every time i log into the student portal and see my academic record because it confirms everything i already believe about myself,Mental Health,10,0.98,9.96,critical
my partner told me that if i ever leave him he will post private videos of me online and send them to my family and i am paralised by fear and dont know what to do or who i can trust,Abuse,10,0.98,9.96,critical
i was assaulted by a member of res staff and i reported it to the warden and they told me to be careful about making accusations and now i feel like the institution is protecting him not me,Abuse,10,0.98,9.96,critical
i was threatened at knifepoint near the campus gate last night and i ran but the person knows where i live in res and i am too scared to go outside and i dont know who to tell,Safety,10,0.98,9.96,critical
wanna die tbh not coping at all,Mental Health,10,0.98,9.96,critical
thought abt ending it again last nite,Mental Health,10,0.98,9.96,critical
life is pointles i want it to stop,Mental Health,10,0.98,9.96,critical
ready to end evreything honestly,Mental Health,10,0.98,9.96,critical
My uncle comes into my room at night and I am afraid to speak up.,Abuse,9,0.97,9.94,critical
My stepfather has been abusing me physically for months and I am too scared to report it.,Abuse,10,0.97,9.94,critical
A peer threatened me with a weapon near campus.,Safety,10,0.97,9.94,critical
Sometimes I want to kill myself when the pressure gets too much.,Mental Health,10,0.97,9.94,critical
I keep telling myself I want to kill myself every morning.,Mental Health,10,0.97,9.94,critical
I wish I could just disappear forever.,Mental Health,10,0.97,9.94,critical
Life is not worth living anymore.,Mental Health,10,0.97,9.94,critical
I think about suicide every time I fail.,Mental Health,10,0.97,9.94,critical
Nobody would miss me if I was gone.,Mental Health,10,0.97,9.94,critical
I feel like everyone would be better off without me.,Mental Health,10,0.97,9.94,critical
I keep fantasizing about my own death.,Mental Health,10,0.97,9.94,critical
i smashed my head against the wall last night during a panic attak and i dont know if that counts as self harm but it scared me and i dont know what is happening to me,Mental Health,10,0.97,9.94,critical
my boyfirend hit me again last night and i coverd the bruises with makeup before my 8am lecture becaus i am so embarased and i dont know who to talk to about this without him finding out,Abuse,10,0.97,9.94,critical
My lecturer invites me to his office alone and makes comments about my body and touches my shoulder and I feel sick every time but I am scared that if I report it nobody will believe me over him.,Abuse,10,0.97,9.94,critical
my farther has been hitting me since i was a child and now that i am at university he still controls me by witholding money when i dont do what he says i am scared and i dont know how to get free from this situation,Abuse,10,0.97,9.94,critical
I have been in an abusive relationship for three years and I finally left but he is now following me across campus and waiting outside my lectures and I am genuinely terrified of what he will do next.,Abuse,10,0.97,9.94,critical
I received a message saying that if I testify in the misconduct hearing against my abuser they will make sure something bad happens to me and I am terrified to go forward but also terrified to stay silent.,Safety,10,0.97,9.94,critical
i have been mixing prescription pills with alcohol to cope with the pressure of exams and last week i passed out in my room and woke up not knowing how many hours had passed and i am scared,Substance Abuse,10,0.97,9.94,critical
I keep thinking about hurting myself and I cannot stop these thoughts.,Mental Health,9,0.96,9.92,critical
My lecturer made sexual advances toward me and I am terrified.,Abuse,10,0.96,9.92,critical
I have been cutting myself daily to cope and the wounds are getting worse.,Mental Health,10,0.96,9.92,critical
I have been feeling hopeless and I do not want to continue anymore.,Mental Health,10,0.95,9.9,critical
I mixed alcohol and sleeping pills last week and I am scared to tell anyone.,Substance Abuse,9,0.95,9.9,critical
Someone has been touching me inappropriately.,Abuse,9,0.97,9.88,critical
I was assaulted by an older student last weekend and told no one.,Abuse,9,0.95,9.88,critical
I have bruises from last night and I need medical help but I am scared.,Abuse,9,0.96,9.84,critical
someone has been following me home from campus every night this week and last night he was waiting outside my door and i am so scared i cant leave my room,Safety,9,0.96,9.84,critical
somone on campus has been leaving notes on my door with very detailed descriptions of my daily routine and it feels like i am being watched all the time and i cant sleep knowing someone knows my movements,Safety,9,0.96,9.84,critical
I am scared my partner will hurt me again.,Abuse,9,0.94,9.82,critical
My housemate physically attacked me and I have injuries.,Housing Issues,9,0.95,9.8,critical
I have been experiencing psychosis and I cannot tell what is real anymore.,Mental Health,9,0.95,9.8,critical
I was physically thrown out of my accommodation by my landlord at midnight with no warning and I have been sleeping outside for two nights because every shelter I called was full.,Housing Issues,9,0.95,9.8,critical
I received a note under my door saying they know where I sleep and what I look like and I do not know who sent it and I am genuinely terrified to be alone on campus.,Safety,9,0.95,9.8,critical
my housemate forces me to give him money every month and threatens to have me removed from the flat if i dont cooperate and i have no lease so i have no protection and nowhere else to go,Abuse,9,0.95,9.8,critical
i havnt been sober in three weeks i wake up and start drinkin before i even brush my teeth and i know i have a serious problem but i feel completely alone in this and too ashamed to tell my family,Substance Abuse,9,0.95,9.8,critical
I am in a relationship where I get hit regularly but I have nowhere to go.,Abuse,9,0.93,9.78,critical
I overdosed on alcohol last night and my friends just laughed.,Substance Abuse,9,0.93,9.78,critical
