text,category,category_weight,urgency_score,priority_score,label
my scholarship requires me to volunteer twenty hours a month and maintain a certain GPA and i cannot meet both requirements and my mental health and the requirement is making everything worse,Financial Problems,7,0.8,7.4,high
i have been doing another students assignments for money because i desperately needed the income and i know it is wrong and i am scared of being caught and i want to stop but i need the money,Academic Stress,7,0.8,7.4,high
i failed my qualifying exams for my phd and i am devastated and my supervisor has not reached out and i have been sitting with this alone for a week and dont know what my options are,Academic Stress,7,0.8,7.4,high
my chronic fatigue syndrome has been very bad this semester and i have accommodations on paper but lecturers do not respect them and one told me that everyone is tired and i need to push through,Disability Support,7,0.8,7.4,high
my roommate has been making racist remarks toward me since we moved in together and when i reported it to the res office they said they would talk to him and nothing changed,Bullying,7,0.8,7.4,high
I was forced to sign a lease I did not fully understand and the terms are exploitative and I am now locked in for the year with conditions I cannot meet and the landlord is threatening legal action.,Housing Issues,7,0.8,7.4,high
i have been verbally harassed by a classmate repeatedly and reported it twice and nothing has been done and i no longer feel safe in that class,Bullying,7,0.8,7.4,high
My accommodation has no running water and the management ignores me.,Housing Issues,6,0.83,7.38,high
I discovered my roommate has been stealing my food and money.,Housing Issues,6,0.79,7.38,high
my roomate is agressive and intimidating and slams doors and screams at night and i am terrified to confront him but i also cant sleep or study and my performance is suffering badly,Housing Issues,7,0.79,7.38,high
my supervisor has not given me feedback on my thesis in four months and my registration expires in three months and i am panicking and emailing every week with no response,Academic Stress,7,0.79,7.38,high
I am an undocumented student and I am terrified of what happens to my status if I fail this year. I cannot access most support services because of my situation and I feel completely alone.,Safety,7,0.79,7.38,high
i nearly failed to submit my dissertation because my mental health collapsed in the final two weeks and i submitted something i know is not my best work and i am devastated and feel like a failure,Academic Stress,7,0.79,7.38,high
A peer submitted my work as their own in a group assignment and received credit and when I raised it with the lecturer I was told there was no way to prove it and I felt completely dismissed.,Bullying,7,0.79,7.38,high
I live off campus and the route home passes an area where I have been verbally harassed multiple times and I am now spending money I do not have on transport to avoid that route,Safety,7,0.79,7.38,high
my flatmate brings strangers into the flat late at night and it is unsafe and I cannot sleep and when I asked him to stop he became aggressive and I am now scared to raise it again,Housing Issues,7,0.79,7.38,high
I am deaf in one ear and I sit at the front of every lecture but many lecturers face the board when they talk and I miss a significant amount of content and when I asked for adjustments nothing happened.,Disability Support,7,0.79,7.38,high
I came to university from a very rural area and the cultural and social gap between me and my peers is enormous and I feel like an outsider in every space I enter and it is affecting my confidence and performance,Mental Health,7,0.79,7.38,high
"I have not been able to make a single friend in two years at this university. I have tried clubs, study groups, residence activities — nothing has worked and I am deeply lonely.",Mental Health,7,0.79,7.38,high
I have been supporting a friend through a severe mental health crisis and it has taken a massive toll on my own wellbeing and I am now struggling myself but feel guilty for making it about me.,Mental Health,7,0.79,7.38,high
i have been systematically excluded from opportunities in my department and i believe it is because of my disability and i dont know how to prove it or who to report it to,Bullying,7,0.79,7.38,high
a staff member made a discriminatory comment about my religion in front of the class and when i reported it i was told it was a misunderstanding and the matter was closed,Bullying,7,0.79,7.38,high
i have been excluded from every study group in my department because of where i come from and it is affecting my grades because we dont get equal access to notes and group work marks,Bullying,7,0.78,7.36,high
I have not told my parents that I have been failing for two semesters. I go home every holiday and pretend everything is fine and the stress of keeping that secret is making everything worse.,Mental Health,7,0.78,7.36,high
My family back home is going through a serious crisis and I am the only one who knows about it and I am trying to support them remotely while also trying to finish my degree and it is destroying me.,Mental Health,7,0.78,7.36,high
i have a severe math anxiety that was never diagnosed or treated and it has affected my performance in quantitative modules throughout my degree and i am only now understanding what has been happening,Disability Support,7,0.78,7.36,high
I have been vaping heavily since first year and I have tried to stop multiple times and I cannot and it is expensive and I think I have a dependency and I want help to quit.,Substance Abuse,7,0.78,7.36,high
I have serious trust issues after being betrayed by a mentor.,Mental Health,7,0.77,7.34,high
somone in my residence spread a false rumour that i have a std and now people avoid me and whisper when i walk past and it is causing me serious distres and isolation,Bullying,7,0.77,7.34,high
i have a severe phobia that is not being accommodated by the university and it directly affects my ability to complete certain assessments and i have tried to get help but nobody takes it seriously,Disability Support,7,0.77,7.34,high
There are rats in my room and my landlord refuses to act.,Housing Issues,6,0.8,7.32,high
My family is pressuring me to quit university and get married.,Mental Health,7,0.76,7.32,high
my classmates keep making jokes about my weight every day and they act like its banter but it is destroying my self esteem and i dread going to class becaus of it,Bullying,7,0.76,7.32,high
I started using drugs because I cannot handle pressure anymore.,Housing Issues,6,0.79,7.3,high
I failed my supplementary exams and I feel there is no way forward.,Academic Stress,7,0.8,7.3,high
I share a room with a stranger who is verbally abusive to me.,Housing Issues,6,0.77,7.26,high
I am about to be excluded for poor academic performance.,Academic Stress,7,0.79,7.26,high
A group chat was made to specifically humiliate me.,Bullying,7,0.78,7.24,high
I am considering dropping out because I cannot keep up anymore.,Academic Stress,7,0.78,7.24,high
I have plagiarized out of desperation and I am terrified of being caught.,Academic Stress,7,0.77,7.22,high
I cannot afford food or transport this semester.,Academic Stress,7,0.77,7.22,high
My classmates formed a group to exclude and isolate me.,Bullying,7,0.75,7.22,high
Someone created a fake social-media account using my name and photos.,Bullying,7,0.76,7.2,high
I receive threatening anonymous messages almost every night.,Bullying,7,0.75,7.18,high
I have not submitted assignments in a month and I am afraid to reach out.,Academic Stress,7,0.76,7.18,high
My supervisor is threatening to remove me from the research program.,Academic Stress,7,0.75,7.18,high
My classmates mock my accent and laugh every time I speak.,Bullying,7,0.74,7.16,high
I was publicly shamed by a lecturer in front of the whole class.,Bullying,7,0.73,7.14,high
I am constantly being bullied online by classmates.,Bullying,7,0.72,7.12,high
I am struggling to pay rent this month.,Financial Problems,5,0.65,5.9,medium
I need to apply for an emergency bursary but I do not know how.,Financial Problems,5,0.63,5.76,medium
i have been sharing one meal a day with my roomate because we are both out of money and we are too proud to ask the university for help but i know we need to do something,Financial Problems,5,0.63,5.76,medium
My NSFAS allowance has not arrived and I have no backup.,Financial Problems,5,0.62,5.74,medium
I have been struggling financially this semester and I had to skip lunch most days to make my transport money last and it is affecting my energy and ability to concentrate in afternoon classes,Financial Problems,5,0.62,5.74,medium
I have been borrowing money from friends and it is creating tension.,Financial Problems,5,0.61,5.72,medium
my student loan application was rejected and my parents cannot cover the shortfall and i am stressed every day about whether i will be able to register for next semester,Financial Problems,5,0.61,5.72,medium
I sold some of my books to cover transport costs.,Financial Problems,5,0.6,5.7,medium
I failed my tests and I feel useless.,Financial Problems,5,0.6,5.7,medium
I borrowed money from a loan shark to pay fees and I am being threatened now.,Financial Problems,5,0.6,5.7,medium
my NSFAS money is three weeks late and i have borrowed from everyone i can and i am too embarased to keep asking and i dont know how i will get through the rest of the month,Financial Problems,5,0.6,5.7,medium
my parents stopped paying my fees mid semester without telling me and I found out when the university blocked my portal and I had to figure out the situation myself which was very stressful,Financial Problems,5,0.6,5.7,medium
My family stopped sending money and I do not know how to manage.,Financial Problems,5,0.59,5.68,medium
I have debt collectors contacting me about student loan repayments.,Financial Problems,5,0.59,5.68,medium
I applied for an emergency bursary two months ago and have not received any feedback and the deadline for my fees is this week and I do not know who to follow up with,Financial Problems,5,0.59,5.68,medium
I have been managing depression with medication but the medication has stopped working and I need to see a psychiatrist to adjust it but the waiting list is very long and I am deteriorating,Mental Health,5,0.59,5.68,medium
I cannot afford data and it is affecting my online studies.,Financial Problems,5,0.58,5.66,medium
My supervisor does not respond to my emails and my thesis is delayed.,Academic Stress,5,0.58,5.66,medium
I am worried I will not finish my degree before my visa expires.,Academic Stress,5,0.58,5.66,medium
I cannot afford the prescribed textbooks for three of my modules this semester and I have been relying on friends to photograph pages and send them to me which is not sustainable,Financial Problems,5,0.58,5.66,medium
I have ADHD and I have not disclosed it to the university because I did not think it would be taken seriously but this semester the workload is more than I can manage without accommodations,Disability Support,5,0.58,5.66,medium
i have been struggling to find reliable accommodation near campus and the commute from where i am staying now takes three hours a day and i am exhausted before i even get to university,Housing Issues,5,0.58,5.66,medium
i cannot afford the field trip that is compulsory for one of my modules and without attending i will lose a significant portion of my final mark and i do not know how to explain this to my lecturer,Financial Problems,5,0.58,5.66,medium
my academic results from last semester were withheld because of an outstanding fee I was not aware of and I could not register on time and lost my place in a module I needed,Financial Problems,5,0.58,5.66,medium
I am stressed about exams and assignments.,Disability Support,5,0.57,5.64,medium
I have been grieving the loss of a family member and struggling to focus.,Mental Health,5,0.57,5.64,medium
I am a single parent and balancing parenting and studying is overwhelming.,Academic Stress,5,0.57,5.64,medium
I have a conflict with my thesis supervisor that is becoming hostile.,Academic Stress,5,0.57,5.64,medium
i am working part time to cover my rent but the job is exhausting and i arrive at morning lectures tired and i feel like i am failing at both work and university at the same time,Financial Problems,5,0.57,5.64,medium
my anxiety makes it really hard to go to the cafeteria alone or sit in crowded lecture halls and i have been skipping meals and avoiding certain classes because of it,Mental Health,5,0.57,5.64,medium
my anxiety disorder is diagnosed and documented but when i asked for exam accommodations the faculty said they needed more forms and more evidence and the process has been going on for three months,Disability Support,5,0.57,5.64,medium
my laptop is very old and it freezes and crashes regularly and i have lost work multiple times because of it and i cannot afford a replacement and it is making everything harder,Financial Problems,5,0.57,5.64,medium
i have been struggling to manage my finances since my bursary was reduced and i have had to cut back on food and transport and it is affecting my energy and focus,Financial Problems,5,0.57,5.64,medium
i had to take an unplanned trip home because of a family emergency and it cost money i didnt have and now i am behind financially and academically and trying to catch up on both,Financial Problems,5,0.57,5.64,medium
i have autism spectrum disorder and i find navigating the unwritten social rules of university life very exhausting and draining and it leaves me with less energy for academic work,Disability Support,5,0.57,5.64,medium
i feel like my neighbourhood has become unsafe at night and I am scared to walk home from late lectures and I am not sure what my options are or who to contact about this,Housing Issues,5,0.57,5.64,medium
I feel like the mental health resources at this university are designed for students whose problems are not that serious. Every time I try to access them I am assessed as not severe enough for support.,Mental Health,5,0.57,5.64,medium
I experience chronic pain that affects my ability to attend classes.,Disability Support,5,0.56,5.62,medium
I am a caregiver at home and it is affecting my studies significantly.,Academic Stress,5,0.56,5.62,medium
I have been missing deadlines because of a chronic illness flare-up.,Disability Support,5,0.56,5.62,medium
I have been struggling with grief this semester after losing my grandmother who raised me and I have not been able to fully engage with my studies and I am not sure how to request support,Mental Health,5,0.56,5.62,medium
i have dyslexia and i struggle significantly with timed exams and reading dense academic text quickly but i have never recieved any formal support and i dont know how to access it,Disability Support,5,0.56,5.62,medium
my room is very cold in winter and there is no heating and i have been getting sick repeatedly and it is affecting my ability to attend class and the landlord says heating is not their responsibility,Housing Issues,5,0.56,5.62,medium
my bank account was debited twice for my res fees and I have been trying to get the refund for six weeks and the finance office keeps telling me it is being processed,Financial Problems,5,0.56,5.62,medium
my concentration has been significantly worse this year and I keep forgetting things and losing track of time and I wonder whether I should be assessed for ADHD because it is impacting everything,Disability Support,5,0.56,5.62,medium
my depression is being treated but the medication has side effects that affect my concentration and energy levels and i need my academics to accommodate this but the process feels very complicated,Disability Support,5,0.56,5.62,medium
i cannot participate equally in group projects because i dont have a reliable laptop and my phone screen is cracked and working on large documents on it is very slow and frustrating,Financial Problems,5,0.56,5.62,medium
i had to cancel a counselling appointment because of a clashing lecture and by the time i tried to rebook the next available slot was six weeks away and things got worse in between,Mental Health,5,0.56,5.62,medium
i have been struggling with the loss of a pregnancy that nobody at university knows about and i have been carrying that grief silently while trying to keep up with my studies,Mental Health,5,0.56,5.62,medium
my disability documentation expired and i need to renew it to maintain my academic accommodations but the process requires multiple appointments and is taking a long time,Disability Support,5,0.56,5.62,medium
I struggle to keep up in lectures because of my hearing impairment.,Disability Support,5,0.55,5.6,medium
I have been struggling with body image issues for a long time.,Mental Health,5,0.55,5.6,medium
I am experiencing burnout and I have lost all motivation to study.,Mental Health,5,0.55,5.6,medium
I need support applying for a disability accommodation at my institution.,Disability Support,5,0.55,5.6,medium
I do not have enough money for graduation fees and I am worried.,Financial Problems,5,0.55,5.6,medium
I moved to a new city for university and I have been here for six months and I still do not have a single real friend and the loneliness is starting to affect my mental health and motivation to attend class,Mental Health,5,0.55,5.6,medium
I have a physical disability that makes long walks across campus very painful and my timetable puts my lectures in buildings on opposite ends of campus with only fifteen minutes between them,Disability Support,5,0.55,5.6,medium
i have been having nightmares that disrupt my sleep almost every night for the past month and i wake up exhausted and it is affecting my concentration and mood throughout the day,Mental Health,5,0.55,5.6,medium
I feel like I have let my family down by not performing as well as they expected at university and the pressure to improve makes it harder to think clearly and I feel stuck in a cycle,Mental Health,5,0.55,5.6,medium
my financial situation has made me very anxious about the future and i find it hard to enjoy university when i am constantly worried about whether i will be able to continue next year,Financial Problems,5,0.55,5.6,medium
i am not sure if what i am feeling is burnout or depression or just being tired but i have lost my motivation completely and i used to love studying and now i dread all of it,Mental Health,5,0.55,5.6,medium
i have been dealing with low level anxiety my whole life but this semester it has been getting more intense and i think i might benefit from speaking to a professional but i am not sure how to access that,Mental Health,5,0.55,5.6,medium
i have a hearing impairment that is not severe enough to qualify for formal accommodations according to the disability office but it still significantly affects my ability to follow lectures,Disability Support,5,0.55,5.6,medium
my accommodation contract ends before my exam period is over and i need to find somewhere to stay for the last two weeks of exams with very little notice and limited budget,Housing Issues,5,0.55,5.6,medium
my sport scholarship requires me to train six days a week and also maintain full time enrollment and this semester the balance has become impossible and both are suffering,Academic Stress,5,0.55,5.6,medium
i feel a lot of cultural pressure to bring honor to my family through my academic results and the gap between that expectation and my actual performance is causing me significant distress,Mental Health,5,0.55,5.6,medium
my research proposal was rejected for the third time and each time the feedback is vague and contradictory and I do not know what the panel actually wants and my supervisor is not helping,Academic Stress,5,0.55,5.6,medium
i have been struggling with gender dysphoria that is untreated and the discomfort of existing in a body that doesnt feel like mine is affecting my ability to be present and engaged at university,Mental Health,5,0.55,5.6,medium
i have been feeling financially anxious all semester and while i am surviving i am constantly stressed about money and it is a persistent background source of worry,Financial Problems,5,0.55,5.6,medium
The campus is not wheelchair accessible and it limits my participation.,Disability Support,5,0.54,5.58,medium
I am struggling to cope after a difficult family divorce.,Mental Health,5,0.54,5.58,medium
"I feel invisible at this university. Nobody in my department knows my name, I have no study group, no friends in my class, and every day I arrive and leave without a single person acknowledging me.",Mental Health,5,0.54,5.58,medium
i feel like my mental health is manageable but only barely and i am one bad thing away from completely falling apart and i dont have any coping strategies that actually work for me,Mental Health,5,0.54,5.58,medium
i feel like i am performing being okay at university rather than actually being okay and the effort of pretending is exhausting and i dont know who i can talk to without being judged,Mental Health,5,0.54,5.58,medium
my relationship with food has become unhealthy this year i skip meals when i am stressed and overeat when i am anxious and i know it is not good but i dont know how to break the pattern,Mental Health,5,0.54,5.58,medium
I am a mature student and I feel a lot of pressure to perform because I gave up a job to come back to study and if I do not do well it feels like a bigger failure than it would be for younger students,Academic Stress,5,0.54,5.58,medium
I feel like I have lost my sense of self since coming to university. Back home I knew who I was but here I do not fit in anywhere and I am still trying to figure out who I am in this new environment.,Mental Health,5,0.54,5.58,medium
I feel a persistent sense of dread every Sunday evening when I think about the week ahead and it has been like this for most of the semester and I think it is more than just normal stress,Mental Health,5,0.54,5.58,medium
i have been having recurring migraines that are getting worse and they are triggered by screen time which makes studying very difficult and i need guidance on what support might be available,Disability Support,5,0.54,5.58,medium
i am a student representative and i am dealing with a lot of other students problems in my capacity and i have started to feel burned out and like my own wellbeing is being neglected,Mental Health,5,0.54,5.58,medium
i have been managing everything on my own since starting university and i have never asked for help and i think the independence has cost me because i never built a support network and i feel alone now,Mental Health,5,0.54,5.58,medium
my mental health support from my home community stopped when I moved to university and I have not been able to replace that structure here and I notice the absence especially in difficult weeks,Mental Health,5,0.54,5.58,medium
i have been struggling with low self-esteem this semester and it is making it hard to advocate for myself in academic settings or ask for help when i need it,Mental Health,5,0.54,5.58,medium
i feel like i never properly recovered emotionally from how hard the previous semester was and i have been carrying that exhaustion into this one without addressing it,Mental Health,5,0.54,5.58,medium
I have ADHD and I do not know how to access support services.,Disability Support,5,0.53,5.56,medium
I have social anxiety and attending seminars is very difficult for me.,Mental Health,5,0.53,5.56,medium
i have been feeling very low for weeks and i cant pinpoint why which makes it harder to explain to anyone i just feel heavy and unmotivated and disconnected from everything around me,Mental Health,5,0.53,5.56,medium
my relationship with my parents has broken down and i am not speaking to them and while i dont want to go into details it is affecting my ability to concentrate and i feel very unsettled,Mental Health,5,0.53,5.56,medium
I am not sure if what I am experiencing counts as depression or just stress but I have had very little joy in anything for months and everything feels flat and effortful and I think I need help,Mental Health,5,0.53,5.56,medium
i have been feeling very anxious about my future career prospects because my degree is in a field with limited job opportunities and i am questioning whether i made the right choice,Mental Health,5,0.53,5.56,medium
i have been feeling unmotivated and slightly depressed since a personal setback earlier in the year but i have been managing on my own and i think some professional support might now be useful,Mental Health,5,0.53,5.56,medium
i have been experiencing what I think is low-level burnout for the last year and while I can still function I am producing work far below what I know I am capable of and it is frustrating,Mental Health,5,0.53,5.56,medium
i feel like i need to talk to someone about some personal difficulties i have been having and i would like to know how to book a counselling session,Mental Health,5,0.53,5.56,medium
i have not been sleeping well for several weeks and while the cause is not entirely clear the impact on my concentration and energy is significant,Mental Health,5,0.53,5.56,medium
i feel like i have been operating below my potential this semester and i want to understand whether there are underlying reasons for that so i can address them,Mental Health,5,0.53,5.56,medium
I have anxiety disorder and crowded exam halls are very difficult for me.,Disability Support,5,0.52,5.54,medium
I feel pressure from my parents to achieve grades I am not capable of.,Mental Health,5,0.52,5.54,medium
I feel like my culture is mocked by lecturers and peers.,Mental Health,5,0.52,5.54,medium
I feel like I am falling behind my peers and it makes me feel worthless.,Mental Health,5,0.52,5.54,medium
