text,category,category_weight,urgency_score,priority_score,label
i have imposter syndrome so badly that i have stopped participating in seminar discussions even when i know the answer because i am scared of sounding stupid in front of everyone,Mental Health,5,0.52,5.54,medium
I feel disconnected from my peers and it is affecting my motivation.,Mental Health,5,0.5,5.5,medium
I am homesick and it is affecting my ability to focus.,Mental Health,5,0.49,5.48,medium
I have been feeling very low lately but I am not sure why.,Mental Health,5,0.48,5.46,medium
Imposter syndrome is making it hard for me to participate in class.,Mental Health,5,0.47,5.44,medium
I feel invisible on campus and nobody notices when I am absent.,Mental Health,5,0.46,5.42,medium
I often feel like I do not belong at this university.,Mental Health,5,0.45,5.4,medium
I struggle to concentrate because of intrusive thoughts.,Mental Health,5,0.44,5.38,medium
I had a painful breakup and I am finding it hard to study.,Mental Health,5,0.43,5.36,medium
I am having constant arguments with my partner and it affects my studies.,Mental Health,4,0.53,5.06,medium
My best friend betrayed my trust and I feel isolated.,Mental Health,4,0.52,5.04,medium
I feel like my family does not support my education choices.,Mental Health,4,0.51,5.02,medium
I am struggling to make friends and it makes me feel out of place.,Mental Health,4,0.5,5.0,medium
I missed one lecture and feel behind.,Mental Health,4,0.5,5.0,medium
I have a learning disability but have not received any academic accommodations.,Mental Health,4,0.49,4.98,medium
A conflict with my roommate is making home life unbearable.,Mental Health,4,0.48,4.96,medium
My internet connection makes studying difficult sometimes.,Mental Health,4,0.48,4.96,medium
I do not feel represented or included in my department.,Mental Health,4,0.48,4.96,medium
Campus noise sometimes affects my concentration.,Mental Health,4,0.47,4.94,medium
I argued with my friend and now I feel distracted.,Mental Health,4,0.46,4.92,medium
I do not know how to write a proper research proposal.,Academic Stress,4,0.57,4.64,medium
I missed a key deadline and I am afraid to tell my lecturer.,Academic Stress,4,0.56,4.62,medium
i have been procrastinating so badly this semester that i now have four weeks worth of work to do in one week and the stress is overwhelming and i dont know where to even start,Academic Stress,4,0.56,4.62,medium
I am struggling to understand the course material and feel behind.,Academic Stress,4,0.55,4.6,medium
I need help with time management because I am falling behind.,Academic Stress,4,0.55,4.6,medium
I have been failing to submit assignments not because I do not understand the work but because I have been dealing with a family crisis at home and I cannot bring myself to focus on academic tasks,Academic Stress,4,0.55,4.6,medium
i missed the first two weeks of semester because i was sick and now i am completley lost in all my modules and i dont know how to catch up without missing what is currently being taught,Academic Stress,4,0.55,4.6,medium
I have too many assignments and I cannot rest.,Academic Stress,4,0.58,4.58,medium
Group project members are not cooperating and I am doing everything alone.,Academic Stress,4,0.54,4.58,medium
I have been absent from campus due to a family illness and I am behind.,Academic Stress,4,0.54,4.58,medium
i dont really know how to write a literature review and my supervisor expects me to know and i am too embarased to say i dont and i have been staring at a blank page for two weeks,Academic Stress,4,0.54,4.58,medium
i submitted a plagiarism appeal three weeks ago and have had no update and the original mark of zero is still showing on my results page and i dont know if anyone is processing it,Academic Stress,4,0.54,4.58,medium
I have been procrastinating because of anxiety and now I am overwhelmed.,Academic Stress,4,0.53,4.56,medium
I slept through an important exam and I need guidance on what to do.,Academic Stress,4,0.53,4.56,medium
my group project members have divided themselves into a clique and are exluding me from discussions and making decisions without me and we have a presentation next week and i dont know what is happening,Academic Stress,4,0.53,4.56,medium
my english is not my first language and writing academic essays in english takes me twice as long as my classmates and i feel like i am always behind and not given enough time in exams,Academic Stress,4,0.53,4.56,medium
my attendance has dropped this semester because of a combination of reasons including transport cost health and motivation and i am worried about what happens if i fall below the required threshold,Academic Stress,4,0.53,4.56,medium
I feel like I am not cut out for research and every time I sit down to work on my thesis I feel overwhelmed and end up doing anything else to avoid it and the deadline keeps getting closer,Academic Stress,4,0.53,4.56,medium
my relationship with my thesis topic has become toxic and i dread working on it and i wonder if i need to change my focus or take a break but i dont know if either is possible at this stage,Academic Stress,4,0.53,4.56,medium
i feel stuck in a module that I am not allowed to drop but cannot pass and the repeated failure is destroying my GPA and my confidence and I do not know what my options are,Academic Stress,4,0.53,4.56,medium
my attendance is just below the threshold for automatic exclusion and i have valid reasons but they were not officially documented and i am worried about the consequences,Academic Stress,4,0.53,4.56,medium
i was ill for a week at a critical point in the semester and fell behind in a way i have not been able to recover from and the cumulative effect on my marks has been significant,Academic Stress,4,0.53,4.56,medium
my academic record contains an error that incorrectly shows a fail for a module i passed and i have been trying to get it corrected for three months and nobody takes ownership of fixing it,Academic Stress,4,0.53,4.56,medium
I feel lonely but I am trying to cope.,Academic Stress,4,0.52,4.54,medium
My work-study schedule is unsustainable and I am exhausted.,Academic Stress,4,0.52,4.54,medium
I was involved in a minor accident and I am still shaken.,Mental Health,4,0.52,4.54,medium
I have been struggling with a module I do not understand and the lecturer moves too fast and when I email for help I get a one line reply telling me to read the textbook which I already have,Academic Stress,4,0.52,4.54,medium
I broke up with my long-term partner who was also at this university and now we share three modules and seeing them every day is making it impossible to focus and I am falling behind.,Mental Health,4,0.52,4.54,medium
I have been dealing with serious family conflict back home and I am the only one who can mediate and I spend most evenings on the phone managing it instead of studying and I am falling behind,Mental Health,4,0.52,4.54,medium
my part time job has increased my hours without my agreement and i am struggling to say no because i need the money but it is cutting into my study time significantly,Academic Stress,4,0.52,4.54,medium
I have been overwhelmed by the number of assessments this semester and I feel like I am always rushing and never producing work I am actually proud of and it is demoralizing,Academic Stress,4,0.52,4.54,medium
i have been dealing with a legal issue related to my accommodation deposit and i dont understand the process and i dont have money to consult a lawyer and i feel very stuck,Housing Issues,4,0.52,4.54,medium
I have been struggling with perfectionism this semester and I spend so much time trying to make my work flawless that I run out of time and end up submitting late anyway,Academic Stress,4,0.52,4.54,medium
i have been struggling to write academically this semester my ideas feel clear in my head but when i try to put them on paper they come out confused and my marks have been reflecting that,Academic Stress,4,0.52,4.54,medium
my sleep has been very poor for the past two months and i fall asleep in lectures sometimes and i know i should address it but i do not know what is causing it or where to start,Mental Health,4,0.52,4.54,medium
i am struggling with the transition from high school to university where nobody checks on you and you have to self-motivate and i have not adapted as well as i expected to,Academic Stress,4,0.52,4.54,medium
i am not getting along with my assigned roommate at all and our schedules and habits are completely incompatible and i have requested a room change and been told there is a waiting list,Housing Issues,4,0.52,4.54,medium
i feel significantly underprepared for university compared to students from well-resourced schools and the gap in background knowledge is affecting my confidence and performance,Academic Stress,4,0.52,4.54,medium
my project supervisor keeps canceling our meetings and rescheduling and my deadline is approaching and i have had very little guidance and i am not confident my work is on the right track,Academic Stress,4,0.52,4.54,medium
the academic workload this semester is significantly heavier than previous semesters and i feel like i am constantly running to catch up and never actually arriving anywhere,Academic Stress,4,0.52,4.54,medium
i feel like i am constantly performing being a good student without actually being able to learn and absorb the material because of how fast everything moves,Academic Stress,4,0.52,4.54,medium
my confidence in speaking in tutorials has collapsed this year after a few experiences where my contributions were dismissed and i now stay silent even when i have something to say,Mental Health,4,0.52,4.54,medium
i feel like the university environment brings out the worst of my anxiety and i am noticeably better in holidays and that pattern makes me question whether i am in the right place,Mental Health,4,0.52,4.54,medium
i feel like i am not developing the practical skills i expected from my degree and the gap between what we learn and what employers want is causing me anxiety about my future,Academic Stress,4,0.52,4.54,medium
my module assessments are all clustered at the end of semester with very little spread across the term and the pressure in the final weeks is overwhelming,Academic Stress,4,0.52,4.54,medium
i have been struggling with a module that builds on content from a prerequisite i did not take and the gaps in my foundational knowledge are catching up with me,Academic Stress,4,0.52,4.54,medium
my academic schedule leaves no time for rest or recovery and i am starting to feel the effects physically with headaches and fatigue becoming more frequent,Academic Stress,4,0.52,4.54,medium
I find it hard to speak English in academic settings and it affects my confidence.,Academic Stress,4,0.51,4.52,medium
I failed a year and I feel too embarrassed to return to campus.,Academic Stress,4,0.51,4.52,medium
I submitted the wrong file for my major assignment and only realised after the deadline and the lecturer refused to accept a resubmission and I am worried about how it will affect my final mark,Academic Stress,4,0.51,4.52,medium
I am an international student and the cultural adjustment has been harder than I expected and I am struggling to understand social cues and academic expectations and I feel out of place constantly,Academic Stress,4,0.51,4.52,medium
I feel like I cannot talk to my assigned academic advisor because she seems disinterested every time I try to raise concerns and I leave those meetings feeling worse than before I went in,Academic Stress,4,0.51,4.52,medium
my module is being taught by a lecturer who speaks too fast and uses a lot of jargon and the slides are uploaded with no extra notes and i am struggling to keep up with the content,Academic Stress,4,0.51,4.52,medium
i switched majors at the end of first year and i am now slightly behind in some foundational knowledge that the new department assumes students already have and it is very stressful,Academic Stress,4,0.51,4.52,medium
I have been feeling very homesick this semester especially around cultural celebrations that my family observes and not having that community around me has made me feel quite isolated,Mental Health,4,0.51,4.52,medium
i recently got out of a long term relationship and even though it was the right decision i feel lost without that structure in my life and it is affecting how i approach my daily routine,Mental Health,4,0.51,4.52,medium
i have been struggling to keep my accommodation clean because of low mood and it has become a source of shame and conflict and it is now affecting my sleep and my ability to study at home,Housing Issues,4,0.51,4.52,medium
i have been comparing myself negatively to classmates who seem to have everything figured out and it is making me feel inadequate even though i know comparison is not helpful,Mental Health,4,0.51,4.52,medium
i missed several important emails because my university inbox was full and by the time i cleared it i had missed deadlines i was not even aware of and i dont know how to appeal this,Academic Stress,4,0.51,4.52,medium
i dont have a mentor or role model in my field who looks like me and comes from a similar background and i find that absence really affects my sense of whether i belong and can succeed here,Mental Health,4,0.51,4.52,medium
my phone was used by someone without my permission and private messages were read and shared and while it was not a physical assault it felt like a serious violation of my privacy,Mental Health,4,0.51,4.52,medium
my grades dropped after I changed modules and the new module has a completely different marking style and I do not understand what is expected of me and I feel too embarrassed to ask,Academic Stress,4,0.51,4.52,medium
i have a complex relationship with my identity at university where i present differently in different spaces and the effort of code-switching all the time is exhausting and takes energy i need for studying,Mental Health,4,0.51,4.52,medium
i feel like my department assumes a level of cultural knowledge in the curriculum that students like me from different backgrounds simply do not have and nobody has offered to bridge that gap,Academic Stress,4,0.51,4.52,medium
i feel guilty about how little i have achieved this semester compared to my first year and i know comparing is unfair but i cannot shake the feeling that i have wasted this year,Mental Health,4,0.51,4.52,medium
i have been feeling disconnected from my studies and struggling to find motivation but i am managing to keep up with submissions even if the quality is not what i want it to be,Academic Stress,4,0.51,4.52,medium
my module has no textbook and relies entirely on lecture slides which are sparse and i am finding it very hard to study for the exam with so little material to work from,Academic Stress,4,0.51,4.52,medium
i have been questioning whether i am in the right field and these doubts are affecting my engagement with my studies and i would benefit from some career guidance,Academic Stress,4,0.51,4.52,medium
i feel overwhelmed when thinking about life after graduation and the job market and i would benefit from structured support around career planning and next steps,Academic Stress,4,0.51,4.52,medium
I do not understand how to register for next semester and the deadline is close.,Academic Guidance,4,0.5,4.5,medium
My phone was stolen and I cannot access online learning platforms.,Financial Problems,4,0.5,4.5,medium
I cannot concentrate in exams because of test anxiety.,Mental Health,4,0.5,4.5,medium
i have been having constant conflict with my roomate about cleaning and noise and guests and it has made the flat feel toxic and i dread going home after class every day,Mental Health,4,0.5,4.5,medium
I feel like my degree was the wrong choice but I am two years in and I do not know whether to change courses or push through and the uncertainty is causing me a lot of anxiety,Academic Stress,4,0.5,4.5,medium
I have gained significant weight this semester due to stress eating and it is affecting my confidence and self-image and I am not sure whether to seek help for it or whether it will resolve on its own,Mental Health,4,0.5,4.5,medium
i struggle a lot with time management and procrastination and i have watched all the youtube videos and read all the articles and nothing seems to work for me long term and i need real help,Academic Stress,4,0.5,4.5,medium
i find it really hard to ask for help when i dont understand something in class because i am scared of looking stupid and then i fall further behind trying to figure things out on my own,Academic Stress,4,0.5,4.5,medium
my lab partner is unreliable and keeps missing our scheduled sessions and I end up doing double the work to keep up and it is not fair but I do not want to cause conflict,Academic Stress,4,0.5,4.5,medium
my parents do not understand university culture and they do not see why I need to spend time on campus after hours for group work and studying and it creates a lot of conflict at home,Mental Health,4,0.5,4.5,medium
my friend group has shifted this semester and I feel left out of plans and conversations and I know it is probably not intentional but it still affects my mood and sense of belonging on campus,Mental Health,4,0.5,4.5,medium
i feel like I am constantly behind in life compared to my peers outside of university who are already working and earning and I question whether my degree is worth the sacrifices I am making,Mental Health,4,0.5,4.5,medium
my residence does not have a quiet study space and the common areas are always noisy and i cannot afford to go to coffee shops to study and i need somewhere to go,Housing Issues,4,0.5,4.5,medium
i have been trying to transfer to another university for a year and the process has been confusing and slow and i am stuck in a program i no longer want to be in and it is affecting my motivation,Academic Stress,4,0.5,4.5,medium
i have been finding it difficult to set boundaries with classmates who want my help all the time and i end up spending hours on their problems and falling behind on my own work,Mental Health,4,0.5,4.5,medium
i feel like i give more to friendships than i receive and it has left me feeling drained and undervalued and i dont know whether to address it directly or just slowly pull back,Mental Health,4,0.5,4.5,medium
i have been dealing with a skin condition that has flared up badly this semester and the physical discomfort and self-consciousness about my appearance have been affecting my confidence in class,Mental Health,4,0.5,4.5,medium
i had a close friend at university who transferred to another institution and since they left i have felt much lonelier and i have not been able to fill that gap with new friendships,Mental Health,4,0.5,4.5,medium
i missed out on a competitive opportunity because nobody told me about it and it was shared only in a group chat that I had been excluded from and I found out after the deadline passed,Academic Stress,4,0.5,4.5,medium
i have been struggling with religious doubt since starting university and while i dont think its something the university can help with it has destabilised a big part of how i understood myself,Mental Health,4,0.5,4.5,medium
my flat has persistent plumbing issues that the landlord keeps promising to fix and never does and it is inconvenient and frustrating but not yet a safety issue,Housing Issues,4,0.5,4.5,medium
i have been dealing with a conflict in my close friend group that has made the social environment on campus feel tense and it is affecting my enjoyment of university life,Mental Health,4,0.5,4.5,medium
my relationship with a housemate has become strained and the tension in our shared space is affecting my ability to study and relax at home,Housing Issues,4,0.5,4.5,medium
i have been dealing with some personal issues that i prefer not to detail but they have affected my attendance and i want to know what documentation i need to provide,Academic Stress,4,0.5,4.5,medium
I feel like my lecturers are dismissive when I ask questions.,Academic Stress,4,0.49,4.48,medium
my faith community at home is a big part of my identity and i havent found anything similar at university and the absence of that support structure is affecting me more than i expected,Mental Health,4,0.49,4.48,medium
i feel like i am not making the most of my time at university and i want to be more intentional about how i use my years here both academically and personally,Academic Stress,4,0.49,4.48,medium
I need a mentor but I do not know how to find one.,Academic Guidance,4,0.48,4.46,medium
my student card expired and accessing campus services has been very complicated since then and the renewal process has taken much longer than it should,Academic Stress,3,0.45,3.9,medium
My laptop battery dies quickly and it slows me down.,Mental Health,3,0.35,5.3,low
I am nervous about an upcoming presentation.,Academic Stress,3,0.4,3.6,low
I find it hard to ask questions in class because I feel shy.,Academic Stress,3,0.38,3.52,low
I had a minor disagreement with a classmate.,Mental Health,3,0.37,3.44,low
My reading list is long and I do not know where to start.,Academic Stress,3,0.36,3.32,low
I am unsure which elective to choose next term.,Mental Health,3,0.35,3.2,low
I sometimes find it hard to balance socializing and studying.,Academic Stress,3,0.34,3.08,low
I need to improve my essay writing skills.,Mental Health,3,0.33,3.06,low
I need to improve my note-taking during lectures.,Mental Health,3,0.33,3.06,low
I forgot my student card and could not access the library.,Academic Stress,3,0.32,3.04,low
I have been waking up late and missing morning lectures.,Academic Stress,3,0.3,3.0,low
I forgot about a small quiz and am disappointed in myself.,Mental Health,3,0.31,2.98,low
I am nervous about my first time presenting to a large group.,Academic Stress,3,0.32,2.94,low
I am adjusting to a new city and feeling a little out of place.,Mental Health,3,0.31,2.9,low
I need advice on how to prepare for semester exams.,Academic Stress,3,0.28,2.88,low
I feel tired after a long week but I am managing.,Academic Stress,3,0.3,2.88,low
I want advice on improving my study habits.,Academic Stress,3,0.3,2.88,low
I spilled water on my laptop and lost all my assignment work.,Academic Stress,3,0.3,2.88,low
I feel a little anxious before group discussions but I manage.,Mental Health,3,0.3,2.88,low
I am a bit stressed about my upcoming presentation but I have practised several times and I think I will be okay I just need some tips on managing nerves on the day,Academic Stress,3,0.3,2.88,low
i am feeling a bit anxious about my mid semester results coming out because i dont know if i did as well as i hoped but i am trying not to overthink it until i see the marks,Mental Health,3,0.3,2.88,low
I could not attend a class because of transport issues today.,Academic Stress,3,0.29,2.86,low
I feel slightly demotivated after receiving average feedback.,Academic Stress,3,0.28,2.84,low
I sometimes feel like I chose the wrong major but I am figuring it out.,Academic Stress,3,0.28,2.84,low
I forgot to save my assignment before submitting and I am not sure the right version was uploaded but it is probably fine I just want to double check the process for resubmission,Academic Stress,3,0.28,2.84,low
I feel like I need to improve my essay writing but I do not know where to start. My marks are average but not failing and I want to push them higher next semester.,Academic Stress,3,0.28,2.84,low
I sometimes feel nervous when I have to work with students I do not know in a group project but once I get talking to them it is usually fine and the anxiety goes away quickly,Mental Health,3,0.28,2.84,low
I have been feeling a bit flat this week but nothing serious I think I just need a good weekend of rest and some time away from books to recharge before the next push,Mental Health,3,0.28,2.84,low
my handwriting is very slow and i sometimes struggle in handwritten exams to finish in time even when i know the content and i wonder if there is any accommodation available for this,Academic Stress,3,0.28,2.84,low
I feel behind after returning from a short holiday.,Academic Stress,3,0.27,2.82,low
i sometimes feel overwhelmed at the start of a new semester when all the due dates are announced at once but once I make a study plan I usually feel better,Academic Stress,3,0.27,2.82,low
i feel slightly behind after taking a few days off during a public holiday weekend and i need to motivate myself to catch up but i am finding it hard to get started again,Academic Stress,3,0.26,2.82,low
i feel slightly overwhelmed this week because three deadlines fall on the same day but i have already started planning and i think i can manage it if i stay focused,Academic Stress,3,0.27,2.82,low
i feel mildly anxious at the beginning of each new topic in a module i find difficult but it usually settles once i have attended the first lecture and done some reading,Mental Health,3,0.26,2.82,low
I feel a little isolated sometimes because I commute from home and do not spend much time on campus after lectures but it is manageable and not something that really affects me deeply,Mental Health,3,0.26,2.82,low
i sometimes compare myself to classmates who seem to grasp content faster and it makes me feel behind but i know that everyone learns differently and i try to remind myself of that,Mental Health,3,0.27,2.82,low
I am a bit stressed about whether my part time job will affect my academic performance this semester but so far I am managing and I think the structure is actually helping me stay organised,Academic Stress,3,0.27,2.82,low
I had a minor disagreement with a friend in my study group and it was resolved by the end of the day but it made me distracted for the morning session,Mental Health,3,0.25,2.78,low
