text,category,category_weight,urgency_score,priority_score,label
I got a lower mark than I expected on a quiz and it knocked my confidence a little but I went back through the material and I understand where I went wrong now,Academic Stress,3,0.25,2.78,low
I feel slightly nervous about approaching my lecturer during office hours because I do not want to seem like I did not understand the lecture but I know I should just go and ask,Mental Health,3,0.25,2.78,low
sometimes i feel like i chose the right degree but the wrong university and i wonder if i would be happier somewhere else but it is a passing feeling and i am not seriously considering transferring,Mental Health,3,0.25,2.78,low
I get mildly anxious before every exam even when I have prepared well and I would like to learn some strategies for managing pre-exam nerves,Mental Health,3,0.25,2.78,low
i have been a bit anxious about a module that I struggle with but I have made an appointment to speak to the tutor and I think that will help clarify things,Academic Stress,3,0.25,2.78,low
I need to find a quiet place to study off campus.,Academic Stress,3,0.29,2.76,low
i dont love my degree but i am in the final year and plan to finish it and then explore options afterwards so it is manageable even if it is not what i imagined it would be,Academic Stress,3,0.24,2.76,low
i felt embarrassed during a tutorial when the lecturer pointed out an error in my work in front of others but it was a minor moment and i have moved past it,Mental Health,3,0.24,2.76,low
I find it harder to stay motivated toward the end of semester and I would appreciate tips on maintaining momentum in the final weeks before exams,Academic Stress,3,0.24,2.76,low
I feel slightly self-conscious about my writing in English because it is my second language but my marks have been good so I think I am managing better than I feel,Mental Health,3,0.24,2.76,low
i feel slightly underprepared for a seminar presentation next week but i have time to fix that if i focus this weekend and i have done it before and it usually goes fine,Academic Stress,3,0.24,2.76,low
I sometimes find it hard to switch off from studying at the end of the day and I lie in bed thinking about academic tasks but it has not seriously affected my sleep,Mental Health,3,0.23,2.76,low
my seminar contribution has been lower than i want it to be this semester mainly because i take time to formulate thoughts and the conversation often moves on before i am ready to speak,Mental Health,3,0.23,2.76,low
i need to figure out how to pace my thesis writing better because i tend to work in long intense bursts and then crash and the output is inconsistent and hard to sustain,Academic Stress,3,0.23,2.76,low
I feel a mild pressure from family to get top marks every semester and while it is well-intentioned it adds stress and I would like strategies for managing external academic expectations,Mental Health,3,0.22,2.76,low
i have been feeling slightly more stressed than usual this week due to a number of small things happening at once but nothing that is genuinely causing me serious difficulty,Mental Health,3,0.22,2.76,low
I need help understanding the registration process.,Academic Stress,3,0.27,2.74,low
I feel a bit behind after a short illness last week.,Academic Stress,3,0.28,2.72,low
I could not find a study space on campus today.,Academic Stress,3,0.25,2.7,low
I need guidance on how to email a lecturer professionally.,Mental Health,3,0.26,2.7,low
Where can I get counseling services on campus?,Academic Stress,3,0.25,2.68,low
I am unsure how to reference sources in APA format.,Academic Stress,2,0.24,2.64,low
My study group meets at a time that conflicts with my schedule.,Academic Stress,2,0.23,2.6,low
My printer broke and I could not submit a physical assignment.,Academic Stress,2,0.22,2.52,low
Can someone explain scholarship opportunities available?,Academic Stress,2,0.22,2.52,low
I feel slightly anxious about meeting new people this semester.,Academic Stress,2,0.21,2.5,low
I have been feeling slightly unmotivated this week.,Academic Stress,2,0.2,2.48,low
I got a lower grade than expected and want to do better.,Academic Stress,2,0.2,2.48,low
I feel a bit overwhelmed by the amount of reading required.,Academic Stress,2,0.18,2.44,low
I would like guidance on choosing my courses.,Academic Stress,2,0.19,2.44,low
My Wi-Fi keeps disconnecting during online lectures.,Academic Stress,2,0.22,2.22,low
I find early morning lectures hard because I am not a morning person and my concentration is low in the first hour but I always catch up with the recordings later,Academic Stress,2,0.22,2.22,low
i missed a tutorial and found out later there was important information shared in it that was not recorded and i had to get notes from three different people to piece it together,Academic Stress,2,0.22,2.22,low
I am a bit worried about a test next week but I have been attending every class and I think if I review my notes this weekend I should be fine,Academic Stress,2,0.22,2.22,low
I need advice on how to manage my time between two part-time jobs.,Academic Guidance,2,0.21,2.21,low
I need to improve my reading speed because I fall behind on the weekly readings and by the time lectures come around I have only read half of what I was supposed to,Academic Stress,2,0.21,2.21,low
my concentration dips in the afternoon after a long morning of lectures and i sometimes read the same paragraph multiple times without it sinking in which is a bit frustrating,Academic Stress,2,0.21,2.21,low
I need to improve my exam technique because I tend to run out of time even when I know the content well and I want to practice past papers under timed conditions before the finals,Academic Stress,2,0.21,2.21,low
I need tips on how to stay focused during long study sessions.,Academic Guidance,2,0.2,2.2,low
I want to improve my public speaking but I do not know where to start.,Academic Guidance,2,0.2,2.2,low
i slept through my alarm and missed a morning lecture today and i feel bad about it but it was just one class and i have already asked a classmate for the notes,Academic Stress,2,0.2,2.2,low
my study space at home is noisy because i live with a big family and i sometimes struggle to focus but i manage by using the library during busy periods,Academic Stress,2,0.2,2.2,low
my timetable this semester is a bit scattered with big gaps between lectures and i am struggling to use those gaps productively instead of just sitting on my phone,Academic Stress,2,0.2,2.2,low
my computer mouse stopped working during an online exam and i panicked but managed to complete it using keyboard shortcuts and reported the issue to the lecturer afterwards,Academic Stress,2,0.2,2.2,low
I failed a small class test but it only counts for five percent so it will not impact my final mark much and I have used it to identify areas I need to focus on going forward,Academic Stress,2,0.2,2.2,low
i missed a tutorial recording and the link expired and i need to ask the tutor for access but i keep forgetting to send the email and falling further behind,Academic Stress,2,0.2,2.2,low
my mentor meeting was rescheduled twice and I have not received feedback on a draft I submitted four weeks ago and I would like to follow up but am not sure how to phrase the email,Academic Stress,2,0.2,2.2,low
I accidentally submitted a draft instead of my final essay and caught it within an hour and the lecturer allowed me to resubmit but it was a stressful experience I want to avoid in future,Academic Stress,2,0.2,2.2,low
i feel a little anxious about an upcoming test but i have started revising and i expect that anxiety to reduce as i feel more prepared over the next few days,Academic Stress,2,0.2,2.2,low
I find reading long academic papers tiring and I need strategies.,Academic Guidance,2,0.19,2.19,low
sometimes campus food options dont suit my dietary requirements and i end up spending more money than planned eating off campus which adds up over the semester,Academic Stress,2,0.19,2.19,low
I feel like I could be more organized with my notes and I want to find a better system before the end of semester exams so I am not scrambling through pages of disorganized content,Academic Stress,2,0.19,2.19,low
i feel like i do not take good enough notes during lectures and i end up going back to record readings and spending more time than necessary when studying and i want to get better at it,Academic Stress,2,0.19,2.19,low
I feel slightly behind after taking a long weekend but I have a plan to catch up and I just need to stick to it this week,Academic Stress,2,0.19,2.19,low
my reading list has some texts that are hard to find in the library and I have been unable to access them and I am not sure what the alternative is,Academic Stress,2,0.19,2.19,low
i need to improve my exam time management because i always leave the last question rushed but my overall results have still been passing so it is more of a refinement than a crisis,Academic Stress,2,0.19,2.19,low
i have been slightly behind on my reading for one module and i plan to catch up this week before the content in the lectures makes it obvious that i havent done the work,Academic Stress,2,0.19,2.19,low
I need help understanding how to use the university library database.,Academic Guidance,2,0.18,2.18,low
I keep forgetting to check my university email regularly.,Academic Stress,2,0.18,2.18,low
my printer ran out of ink the morning my assignment was due and i had to find a print shop and i was five minutes late dropping it off which was stressful but it worked out,Academic Stress,2,0.18,2.18,low
i had a small falling out with my roommate about dishes and it was a bit tense for a day but we talked it out and things are back to normal now,Mental Health,2,0.18,2.18,low
my bus to campus is often late and it makes me anxious about arriving on time for early lectures but it has not caused me to miss anything important yet,Academic Stress,2,0.18,2.18,low
i am a first year student and i still dont fully understand how the academic credit system works and i want to make sure i am taking the right number of modules for my qualification,Academic Stress,2,0.18,2.18,low
i feel a bit drained after a long week but a good sleep and some time with friends usually helps me reset and i expect to feel better by monday morning,Mental Health,2,0.18,2.18,low
i got nervous during my oral presentation and lost my place for a moment but i recovered and overall i think it went reasonably well and i am not too worried about the mark,Mental Health,2,0.18,2.18,low
i have been a bit scattered this week because i had a lot of social plans alongside my academic commitments but i expect to be back on track next week,Academic Stress,2,0.18,2.18,low
i feel a bit overwhelmed when looking at the whole semester plan but when I break it into weekly goals it becomes much more manageable and I usually cope fine,Academic Stress,2,0.18,2.18,low
i sometimes get distracted on social media when I should be studying and I have been trying different apps to help me focus with mixed results,Academic Stress,2,0.18,2.18,low
I feel slightly stressed about the number of readings assigned this week but it is manageable and I have done more in previous weeks so I know I can get through it,Academic Stress,2,0.18,2.18,low
i sometimes find it hard to concentrate in the library because it is too quiet and in my room it is too noisy and i have not found my ideal study environment yet,Academic Stress,2,0.18,2.18,low
i have been going to bed too late most nights this semester and my mornings are suffering for it and i know the solution but i have not been disciplined enough to implement it,Mental Health,2,0.18,2.18,low
I realised I have been formatting my bibliography incorrectly all semester and I need to go back and correct several submitted assignments before the final submission window closes,Academic Stress,2,0.18,2.18,low
i find it hard to concentrate during very long lectures and i tend to switch off after about an hour which means i miss content toward the end of longer sessions,Academic Stress,2,0.18,2.18,low
my phone battery dies quickly and it makes me anxious when i am on campus all day and cannot charge it but i am managing with a portable charger most of the time,Academic Stress,2,0.17,2.17,low
my study group meets at a time that is not ideal for me but i attend anyway because the collaboration helps and i just rearrange my personal schedule to make it work,Academic Stress,2,0.17,2.17,low
i have been a bit tired lately and i think i need to be more intentional about my sleep schedule because late nights have been affecting my mornings,Mental Health,2,0.17,2.17,low
my group has different ideas about how to approach our project and we had a mild disagreement in our last meeting but we resolved it without it becoming a real conflict,Academic Stress,2,0.17,2.17,low
my schedule this semester has back-to-back lectures on Thursdays with no break and it is a long and tiring day but I manage it and I have accepted it as part of this semester,Academic Stress,2,0.17,2.17,low
I sometimes feel a little unmotivated on Monday mornings but a coffee and a short walk to campus usually resolves it and I am always fine once lectures start,Mental Health,2,0.17,2.17,low
I feel slightly nervous about applying for my first internship but it is a good kind of nervous and I am prepared and I just want some last-minute advice on my CV,Academic Stress,2,0.17,2.17,low
I feel like I need to be better at asking questions in class. I often wait until after the session to look up what I did not understand and that slows me down during revision.,Academic Stress,2,0.17,2.17,low
i feel a bit disconnected from my degree this semester and i am hoping the next set of modules will be more interesting to me because the current ones feel very abstract and removed from practice,Academic Stress,2,0.17,2.17,low
i sometimes feel a bit awkward at social events on campus but it is nothing serious and i usually warm up after a while and end up enjoying myself,Mental Health,2,0.17,2.17,low
i forget to check my student email for days at a time and sometimes miss announcements because of it and i know i need to build a better habit of checking it regularly,Academic Stress,2,0.16,2.16,low
my roomate plays music late at night sometimes and it wakes me up but we have a decent relationship and i know if i ask him to use headphones he will be fine about it,Academic Stress,2,0.16,2.16,low
i got feedback that my referencing was inconsistent in my last assignment and i need to go back over the guidelines and make sure i am doing it correctly going forward,Academic Stress,2,0.16,2.16,low
my module coordinator changed mid-semester and the transition was a bit rocky but things have settled down and the new coordinator seems competent and approachable,Academic Stress,2,0.16,2.16,low
i feel a bit uncomfortable in a module where the lecturer uses a very casual teaching style and it takes me a while to adjust to different teaching approaches,Academic Stress,2,0.16,2.16,low
my group presentation partner and I have very different ideas about the visual design of our slides and we need to find a compromise but it has not been a significant conflict,Academic Stress,2,0.16,2.16,low
my roommate and i have different sleep schedules and while we have discussed it and reached a workable compromise it is still occasionally disruptive and something i am adjusting to,Academic Stress,2,0.16,2.16,low
my module outline was updated mid-semester and i missed the announcement and had to scramble to catch up but i have sorted it now,Academic Stress,2,0.16,2.16,low
i feel like this semester has gone by very fast and i am not sure i have made the most of it but nothing specific is wrong and i am generally doing okay,Mental Health,2,0.16,2.16,low
I am not sure which citation format my department uses for research papers and I keep mixing up APA and Harvard and I need clarification before I submit my next assignment,Academic Stress,2,0.15,2.15,low
I need help deciding between two elective modules and I am not sure which one will be more useful for my career path and I would appreciate some guidance from an advisor,Academic Guidance,2,0.15,2.15,low
I misread a due date and submitted an assignment a day early thinking it was late and now I feel a bit embarrassed but it turned out fine and the assignment has been accepted,Academic Stress,2,0.15,2.15,low
my study habits need improvement and I know it but I am not sure where to start and I would appreciate some general guidance on effective revision strategies,Academic Guidance,2,0.15,2.15,low
I need to find a good note-taking app because my current system is not working well and I spend too much time searching for information when I revise,Academic Stress,2,0.15,2.15,low
my landlord is a bit slow to respond to messages but nothing is broken and the accommodation is generally fine it just requires a bit of patience,Housing Issues,2,0.15,2.15,low
I sometimes feel like the campus is too big and I waste time walking between buildings and I am still figuring out the most efficient routes to my regular venues,Academic Stress,2,0.15,2.15,low
I want to find a study buddy for one of my harder modules because studying alone for it is not working as well and I think working with someone else would help,Academic Guidance,2,0.15,2.15,low
my printer credit ran out and i had to submit a physical document and had to ask a friend to print it for me which was a bit stressful but it worked out,Academic Stress,2,0.15,2.15,low
my alarm did not go off this morning and i missed the first twenty minutes of a lecture and while i was annoyed i was able to get the notes from a classmate and catch up quickly,Academic Stress,2,0.15,2.15,low
i forgot to bring my notes to a tutorial and had to participate from memory which was uncomfortable but i made it through and it reminded me to be more organized,Academic Stress,2,0.15,2.15,low
my student discount on transport expired and I need to renew it but the queue at the transport office has been very long every time I have tried to go,Academic Stress,2,0.15,2.15,low
i have been meaning to visit the writing centre for help with my academic writing but i keep postponing it because i tell myself i dont have time even though i know i should go,Academic Guidance,2,0.15,2.15,low
my submission portal was slow this morning and i panicked but the assignment uploaded successfully before the deadline and everything is fine,Academic Stress,2,0.15,2.15,low
i feel a bit lost about which career direction to pursue after my degree but i am in second year so i know i have time and i am not panicking just curious about my options,Academic Guidance,2,0.15,2.15,low
i feel slightly bored in one of my modules because the content covers things i already know well and i would like to know if there is a way to challenge or extend myself further,Academic Stress,2,0.15,2.15,low
i have been trying to read more broadly outside of my curriculum to build my general knowledge and i am looking for recommendations on where to start,Academic Guidance,2,0.14,2.14,low
my campus navigation app keeps directing me to the wrong building and I have been late to two sessions because of it and I need to figure out how to update the map,Academic Stress,2,0.14,2.14,low
I feel like I am not using the university resources as well as I could be and I would like to know more about what academic and personal support services are actually available,Academic Guidance,2,0.14,2.14,low
I want to ask my lecturer a question but they have very limited office hours and I am not sure whether to email or wait for the next session,Academic Guidance,2,0.14,2.14,low
my timetable has a two hour gap on wednesday afternoons that i have not been using productively and i want to make better use of that time,Academic Stress,2,0.14,2.14,low
i lost my student card and need to know the fastest way to get a replacement so i can access the library and labs again,Academic Guidance,2,0.14,2.14,low
my headphones broke and studying in noisy environments is harder without them but i am managing with the quieter parts of the library for now,Academic Stress,2,0.14,2.14,low
i need to renew my library card and i am not sure of the process since the system changed earlier this year,Academic Guidance,2,0.13,2.13,low
i want to start going to the gym on campus but i do not know what facilities are available or how to access them as a student,Student Life,2,0.13,2.13,low
i would like to know how to volunteer as a peer note-taker for a student with a disability and whether this can count toward my co-curricular record,Student Life,2,0.13,2.13,low
I want to find out more about wellness programs offered on campus.,Mental Health,2,0.17,2.17,neutral
What support is available for international students on campus?,Academic Guidance,2,0.16,2.16,neutral
I would like to know what internships are available for my field.,Career Services,2,0.15,2.15,neutral
How do I request a study permit extension as an international student?,Academic Guidance,2,0.15,2.15,neutral
I am looking for information about the university's counseling and psychological services including how to book a session and whether there is a cost involved,Mental Health,2,0.15,2.15,neutral
I need help understanding what plagiarism means and how to avoid it.,Academic Guidance,2,0.14,2.14,neutral
What are the requirements for the postgraduate diploma program?,Academic Guidance,2,0.14,2.14,neutral
I would like information about the university's policy on requesting a deferral due to medical reasons and what documentation is typically required to support such a request,Academic Guidance,2,0.14,2.14,neutral
Can you explain how credit transfers work if I completed part of my degree at another institution and want to continue here without repeating modules I have already passed,Academic Guidance,2,0.14,2.14,neutral
can you tell me what options are available for students who need to take a leave of absence for personal or medical reasons and what the process is for returning afterwards,Academic Guidance,2,0.14,2.14,neutral
what support services does the university offer for students who are first generation university students and who may not be familiar with how the system works,Academic Guidance,2,0.14,2.14,neutral
what are the rules around bringing a support person or service animal to the campus and are there any forms that need to be completed in advance,Disability Support,2,0.14,2.14,neutral
I am a returning student after a three year break and I would like to know what I need to do to re-register and whether my previous credits will still be recognised,Academic Guidance,2,0.14,2.14,neutral
I want to understand the process for applying for graduation and what requirements need to be met before I can be considered for a degree conferral,Academic Guidance,2,0.14,2.14,neutral
I need information about the summer school program offered by the university including what modules are available the costs involved and how to register for it,Academic Guidance,2,0.14,2.14,neutral
I want to know if the university has a food bank or similar emergency food resource for students experiencing short-term financial difficulty,Financial Aid,2,0.14,2.14,neutral
can you tell me whether the university has a quiet room or sensory room available for students who need a low-stimulation space during the day,Disability Support,2,0.14,2.14,neutral
I would like to know whether the university offers any childcare facilities or subsidies for student parents who need care for young children during class hours,Student Life,2,0.14,2.14,neutral
I would like to know whether the university has a peer support network for students experiencing mental health challenges and how to access it,Mental Health,2,0.14,2.14,neutral
what is the procedure for arranging alternative assessment conditions for a student who experiences a medical emergency immediately before or during an exam,Academic Guidance,2,0.14,2.14,neutral
I want to know whether I can request to complete my degree part time due to personal circumstances and whether this affects my financial aid eligibility,Academic Guidance,2,0.14,2.14,neutral
Can I get more information on how the academic appeals process works?,Academic Guidance,2,0.13,2.13,neutral
I would like to book an appointment with a financial aid advisor.,Financial Aid,2,0.13,2.13,neutral
I would like to understand how the university's academic exclusion policy works and under what circumstances a student can appeal an exclusion decision successfully,Academic Guidance,2,0.13,2.13,neutral
I am interested in applying for a postgraduate research grant and I would like to know what the eligibility criteria are and when the next application cycle opens,Financial Aid,2,0.13,2.13,neutral
I need to know what the university's policy is on regrading or remarking assessments when a student believes there was an error in the marking,Academic Guidance,2,0.13,2.13,neutral
I want to know how to access the online career services portal and what kinds of services are available for final year students looking for graduate employment opportunities,Career Services,2,0.13,2.13,neutral
can you please explain how the examination timetable is released and where students can access it and whether it is possible to request an alternative exam time due to a clash,Academic Guidance,2,0.13,2.13,neutral
I would like guidance on how to write a professional email to a lecturer requesting an extension on an assignment due to personal circumstances,Academic Guidance,2,0.13,2.13,neutral
i want to know if the university offers free legal advice or a student legal clinic for students dealing with housing disputes or contract issues with landlords,Academic Guidance,2,0.13,2.13,neutral
